Job_id,Title,Location,Company,Synopsis,Low_Salary,High_Salary,City,State_Initials
276,            Associate Data Scientist - NYC Headquarters,"New York, NY 10016 (Gramercy area)",        Unified,"            As an Associate Data Scientist, you will derive impactful insights from data to drive intelligence for Unified and it’s clients....",103000,151000,New York, NY
277,            Design & Research Analyst (Data),"New York, NY 10004 (Financial District area)",        New York City TAXI & LIMOUSINE COMMISSION,"            Mine existing data sources to understand common issue trends; Foundational knowledge of data analysis using tools like R, Python, or SQL;...",52524,54000,New York, NY
278,Data Scientist - Uber Everything (NYC),"New York, NY 10018 (Clinton area)",        Uber,"            To solve these problems, data scientists leverage unique data sources diverse in both geographical and temporal dimensions and in both structured (data from app...",105000,155000,New York, NY
279,Data Scientist,"New York, NY",        HelloFresh,            We're hiring a Data Scientist to join our Supply Chain Analytics Team here at HelloFresh. Fluency in managing and analyzing large data sets of data with...,100000,147000,New York, NY
280,Data Scientist,"New York, NY 10011 (Chelsea area)",        WebMD,"            As a Data Scientist, you will lead the development of cutting edge machine learning methods that solve key problems in measurement and the audience development...",116000,171000,New York, NY
281,Data Scientist,"New York, NY 10001 (Chelsea area)",        Roku,"Data Scientists move quickly and prototype new solutions methodically. At Roku, Data Scientists leverage Big Data and machine learning to maximize efficiency...",111000,163000,New York, NY
282,"Data Scientist, User Fraud","New York, NY 10011 (Chelsea area)",        Spotify,"            We are looking for a Senior Data Scientist to join the band and help drive a data-first culture, focused on user fraud prevention, detection and research....",127000,187000,New York, NY
283,Data Scientist Intern/Coop,"Armonk, NY 10504",        IBM,            The GCDO drives the data management and data governance strategy across all of IBM’s data. Understanding of core concepts in Data Science and Machine Learning....,98000,144000,Armonk, NY
284,Data Analysis Lead Specialist,"Philadelphia, PA",        Chester County Intermediate Unit,            Position Type: Contractor / Consultant specializing in Data Analysis Location: Statewide Opportunities *(Location determined regionally based on schools...,30000,44000,Philadelphia, PA
285,            Senior Data Analyst,"Philadelphia, PA 19104 (Belmont area)",        Urban Health Collaborative- Drexel University,"            Advanced data compilation and data management skills. Interact with local data teams to acquire, process, and harmonize data....",70000,100000,Philadelphia, PA
286,            Statistical Data Analyst,"Tampa, FL",        University of South Florida,"            4725 / Statistical Data Analyst. Supports the Scientific Director and Staff Scientist in the day-to-day activities of the facility, including but not limited to...",45000,53500,Tampa, FL
287,            Biological Scientist,"Tampa, FL",        University of South Florida,"            5033 / Biological Scientist. Performs analysis of data using statistical software. Maintains logs and records of laboratory techniques, observations, findings,...",32000,38500,Tampa, FL
288,            Customer Facing Data Scientist,"Portland, TX",        DataRobot,            Customer Facing Data Scientists (CFDSs) are critical to making our customers successful. Enabling customers to solve complex data science problems using...,111000,163000,Portland, TX
289,            Research Specialist,"Corpus Christi, TX",        Texas A&M University Corpus Christi,Data Analyses - 40%. Knowledge of coastal and oceanographic data types. The Research Specialist will serve as a Data Scientist in the Coastal and Marine...,40000,61000,Corpus Christi, TX
290,            MARKET RESEARCH ANALYST,"Miami Beach, FL",        IMW Internet Marketing WorldWide,"            Identify the right target, forecast and track marketing and sales trends, analyzing collected data; Collect and analyze data on customer demographics,...",37086,,Miami Beach, FL
291,"Data Scientist, Optimization","Fort Lauderdale, FL","        Magic Leap, Inc.","            Experience with data visualization tool (e.g. Leverages machine learning and data mining techniques. As a Data Scientist, Optimization for Magic Leap's...",102000,151000,Fort Lauderdale, FL
292,Data Reporting/Healthcare Information Data Scientist Sr.,"Memphis, TN 38103 (Downtown area)",        Methodist Le Bonheur Healthcare,            The Healthcare Information Data Scientist Sr indecently functions in an expert capacity producing innovative solutions driven by exploratory data analysis from...,71000,105000,Memphis, TN
293,            Associate Product Owner,"Memphis, TN 37544 (Parkway Village-Oakhaven area)",        St. Jude Children's Research Hospital,"            Jude Cloud data access, develop and utilize software to prepare, annotate, and maintain genomic data files in St....",73000,109000,Memphis, TN
