Company,Glassdoor_Review_Link,date,employee_title,location,employee_status,review_title,years_at_company,helpful,pros,cons,advice_to_mgmt,rating_overall,rating_balance,rating_culture,rating_career,rating_comp,rating_mgmt
UBS,https://www.glassdoor.com/Reviews/UBS-Reviews-E3419.htm,2/14/2019, Intern ,,Current Employee ,Great company structure,Less than a year,0,"I hadn’t worked in financial services before, but UBS gives you the opportunity to contribute to meaningful work as an intern. It’s a great company to work for and fantastic for your resume and connections.","They tend to not automatically hire interns for positions like some other large banks, so be prepared to have to fight for a position if you want to stay with them after graduation.",,5,5,5,3,3,5
UBS,https://www.glassdoor.com/Reviews/UBS-Reviews-E3419.htm,4/18/2019, Investment Banking Analyst,"New York, NY",Current Employee ,Good,Less than a year,0,Typical ib and you know the same,Long hours are the key reason to this,Do more to protect junior employees,5,1,3,5,5,2
UBS,https://www.glassdoor.com/Reviews/UBS-Reviews-E3419.htm,4/17/2019, Systems Engineer,"Nashville, TN",Current Employee ,Awesome place!,More than a year,0,"Very clean and safe environment, lunch areas, convenient location downtown, subsidized parking. Excellent manager in my division, co workers all extremely good at their jobs, no weak links, they have an excellent team.",opportunities to advance are fairly limited....,Keep it up!,4,5,5,3,5,5
UBS,https://www.glassdoor.com/Reviews/UBS-Reviews-E3419.htm,4/16/2019, Analyst,"New York, NY",Former Employee ,Great culture,More than a year,0,Lots of good people working at the company. Great opportunity for mentorship.,Large company so need to stay focused to create your own path.,,5,,,,,
UBS,https://www.glassdoor.com/Reviews/UBS-Reviews-E3419.htm,4/9/2019, Compliance Specialist,,Current Employee ,Love UBS,Less than a year,0,Such a team collaborative environment,Commute isn’t consistent but not bad.,,5,5,5,5,5,5
UBS,https://www.glassdoor.com/Reviews/UBS-Reviews-E3419.htm,4/8/2019, Executive Director,,Former Employee ,aa,More than 8 years,0,"Great people, teamwork, willing to change","WM focus, overly focused on biz cycle (boom//bust)",,4,,,,,
UBS,https://www.glassdoor.com/Reviews/UBS-Reviews-E3419.htm,4/7/2019, Financial Advisor,,Current Employee ,Wealth Advice Center,More than a year,0,"Decent pay, great people, flexible work hours, and good way to get into the industry","Everything is over the phone, overly strict compliance rules, too many managers",,4,4,5,5,3,4
UBS,https://www.glassdoor.com/Reviews/UBS-Reviews-E3419.htm,4/1/2019, Frontend Developer,"Zurich, KS",Current Employee ,Nice place but a lot of overhead,Less than a year,0,Nice and skilled people in my team,"A lot of overhead due to the fact that it is a Swiss bank (strict restriction on web navigation, a lot of time to setup the machine, etc)",,4,5,4,3,4,4
UBS,https://www.glassdoor.com/Reviews/UBS-Reviews-E3419.htm,4/10/2019,,,Former Employee ,ubs wealth advice center,,0,great for entry level looking to become licensed to sell securities,lower management (who you would be working directly under) don't seem to understand a work life balance. Be prepared for many late nights without additional compensation,,3,2,2,3,3,3
UBS,https://www.glassdoor.com/Reviews/UBS-Reviews-E3419.htm,3/28/2019,,,Former Employee ,Former employee,,0,Some very talented people work the firm.,Way to much time and effort devoted to 360 reviews—penalizes people working in small groups or those with very specialized skills sets.,Stop trying to be Goldman Sachs—your not.,4,,,,,
UBS,https://www.glassdoor.com/Reviews/UBS-Reviews-E3419.htm,3/22/2019, Analyst,,Former Employee ,Great Place to Work,More than a year,0,"Great atmosphere.
Management is great
Fun Perks",Nothing I would change now.,,4,5,4,5,4,4
UBS,https://www.glassdoor.com/Reviews/UBS-Reviews-E3419.htm,3/21/2019, Employee Stock Plan Associate,"Weehawken, NJ",Former Employee ,Good Entry Level Job,Less than a year,0,"People were great
Awesome cafeteria
Beautiful location - view of NYC skyline","Pay could have been better
People on the phones could be snappy sometimes",,4,5,4,4,3,4
UBS,https://www.glassdoor.com/Reviews/UBS-Reviews-E3419.htm,3/20/2019, Analyst,,Former Employee ,Great learning and growth opportunity,,0,"benefits, opportunity, connections, growth, dynamic","Schedule, time commitment, various bosses to answer to",,5,,,,,
UBS,https://www.glassdoor.com/Reviews/UBS-Reviews-E3419.htm,3/19/2019,,,Current Employee ,Good company,,0,"Corporate perks, career growth mindset",None that come to mind,,4,3,,,,
UBS,https://www.glassdoor.com/Reviews/UBS-Reviews-E3419.htm,3/15/2019,,,Current Employee ,Good company,More than 3 years,0,Nice culture with lots of flexibility,Business is not growing fast,,4,,,,,
UBS,https://www.glassdoor.com/Reviews/UBS-Reviews-E3419.htm,3/13/2019, Investment Analyst Intern,"Santa Barbara, CA",Former Employee ,Investment Analyst Intern,More than a year,0,Worked with an excellent team. Very educational opportunity to learn more about the facets of finance and gain an understanding of the financial world and terminology.,"19 hour a week maximum time cap on part-time employees.
Pay was minimal or none depending on your team you worked with.",,5,5,4,3,3,3
UBS,https://www.glassdoor.com/Reviews/UBS-Reviews-E3419.htm,3/28/2019, Director,"Chicago, IL",Former Employee ,Experienced Not Needed,More than 8 years,0,"Some good people to work with
Exposure to many facets of business
Good vacation time benefits
Good work location, home office, availability","Pay increases are rare
Company always cost cutting
Experienced personnel pool depleted","Lack of pay adjustments, and continuous cost cutting will eventually leave you with personnel with 2-5 year experience levels. A very short sighted approach.",2,3,2,2,3,3
UBS,https://www.glassdoor.com/Reviews/UBS-Reviews-E3419.htm,3/13/2019, Client Service Associate,"New York, NY",Former Employee ,Good place to work,More than a year,0,,,,4,5,4,4,3,4
UBS,https://www.glassdoor.com/Reviews/UBS-Reviews-E3419.htm,3/13/2019, Intern,"New York, NY",Current Employee ,Great place to work,Less than a year,0,Lots of hands on experience,Overwhelming workload during trading hours,,4,4,4,4,4,4
UBS,https://www.glassdoor.com/Reviews/UBS-Reviews-E3419.htm,3/27/2019, Senior QA Engineer,"Weehawken, NJ",Current Employee ,IT Quality & Test Engineer,More than a year,0,"great atmosphere, new technology",don't fairly review people work,,3,3,3,3,3,3
UBS,https://www.glassdoor.com/Reviews/UBS-Reviews-E3419.htm,3/27/2019, Director,"New York, NY",Current Employee ,No clear vision - disfunxrional place,More than a year,0,Aggressive sign up bonuses,Very short term across division.,Develop a vision please,2,4,1,1,3,1
UBS,https://www.glassdoor.com/Reviews/UBS-Reviews-E3419.htm,3/26/2019,,"Atlanta, GA",Former Employee ,PWM Intern,Less than a year,0,Good company to have on your resume,Poor culture in the office. Everybody has their own practice.,,3,2,1,3,2,2
UBS,https://www.glassdoor.com/Reviews/UBS-Reviews-E3419.htm,3/26/2019, Software Engineer,"Weehawken, NJ",Current Employee ,I would say it's ok,More than a year,0,Great people to work with.,"Some Managers can be micromanagers, which is not the best for people that like autonomy. You will spend more time in meetings than actually working on your stuff.",Stop micromanaging your employees.,2,4,3,3,1,1
UBS,https://www.glassdoor.com/Reviews/UBS-Reviews-E3419.htm,3/11/2019, Analyst,"Stamford, NY",Former Employee ,Good to start with your career,More than a year,0,"good organization, good people to work with",bureaucracy like other big corporations,,4,4,3,5,3,3
UBS,https://www.glassdoor.com/Reviews/UBS-Reviews-E3419.htm,3/21/2019, Client Service Associate,,Former Employee ,Ok,,0,"Name recognition
Long term potential
Learning experience","Very small teams with little interaction
No collaboration",,3,,,,,
UBS,https://www.glassdoor.com/Reviews/UBS-Reviews-E3419.htm,3/6/2019, Business Analyst,"New York, NY",Current Employee ,Business Analyst - Analyst,Less than a year,0,"Great pay, location and benefits",Longer work hours and iffy cafe,,5,3,5,4,5,5
UBS,https://www.glassdoor.com/Reviews/UBS-Reviews-E3419.htm,3/5/2019,,,Current Employee ,Wealth Management Intern,,0,"Great online resources
Friendly work environment",None that I can think of,,5,,,,,
UBS,https://www.glassdoor.com/Reviews/UBS-Reviews-E3419.htm,3/1/2019, Talent Development Specialist,"Weehawken, NJ",Current Employee ,"Nice culture, little leadership",More than a year,0,"Great, smart people
Internal mobility encouraged","Lack of leadership
Barriers to complete final products",,4,4,3,4,4,3
UBS,https://www.glassdoor.com/Reviews/UBS-Reviews-E3419.htm,3/1/2019, Event Marketing,,Former Employee ,Great opportunities and learning,,0,"Lots to learn, team work, great opportunities, very good pay",Can be some work pressure but that works with all companies,,4,4,4,4,,
UBS,https://www.glassdoor.com/Reviews/UBS-Reviews-E3419.htm,2/23/2019, Director,"Stamford, CT",Current Employee ,UBS Review,More than 8 years,0,"Challenging, lot to learn, fun coworkers, work from home allowed","too many hours, no raise or bonus",,4,4,4,4,2,4
